{
  "schema_version": "1.1",
  "kind": "finding",
  "finding_id": "FIND-WIMG-MIG-000001",
  "legacy_ids": ["web-imagegen-repo-local-context-2026-09-06"],
  "project_id": "web-imagegen",
  "task_id": "MIG-YZT-40",
  "summary": "Legacy candidate: V1 repo-local context files (.ai/context.yaml + docs/repo-context.md) landed on branch agent/04-software-engineer/9fa1b3d39d37 @ a0a049b.",
  "detail": "Human decision F-3 (YZT-40): do NOT merge the old V1 repo-local files first and then upgrade. Generate the V1.1 repo-local context directly from current main Reality (@600225a) + the old branch content used only as Migration Evidence. V1.1 file contents produced under migration/repo-local/web-imagegen/. Landing in the product repo is a Cutover-window Software Engineer write; final merge reserved for Human.",
  "intent": "durable_candidate",
  "source_refs": [
    "repo://multica-memory@61c6f0e/sources/candidates/web-imagegen-repo-local-context-2026-09-06.json",
    "repo://web-imagegen@a0a049b/.ai/context.yaml",
    "repo://web-imagegen@600225a/README.md",
    "multica://issue/YZT-40"
  ],
  "discovered_by": "software-engineer",
  "status": "processed",
  "verification": "verified",
  "disposition": "pointer",
  "disposition_note": "V1.1 repo-local content staged at migration/repo-local/web-imagegen/; product-repo landing deferred to Cutover window (SE-owned write, human merge).",
  "disposition_refs": ["migration/repo-local/web-imagegen"],
  "processed_at": "2026-09-08T14:30:00Z",
  "created_at": "2026-09-06T10:05:00Z"
}
