{
  "schema_version": "1.1",
  "kind": "finding",
  "finding_id": "FIND-APP1-MIG-000001",
  "legacy_ids": ["app1-repo-local-context-pointer"],
  "project_id": "app1",
  "task_id": "MIG-YZT-40",
  "summary": "Legacy candidate: add a repo-local context pointer file (.ai/context.yaml) to the App1 product repo when engineering starts and collaborators grow.",
  "detail": "Originally kept as candidate (value limited while repo is docs-only, single writer). V1.1 repo-local context policy (Spec §3.3, R6) supersedes the mechanism: repo-local context files are generated directly from main reality at engineering start and upgraded to schema 1.1; the shared-memory pointer content moves into the V1.1 .ai/context.yaml shape.",
  "intent": "durable_candidate",
  "source_refs": [
    "repo://multica-memory@61c6f0e/sources/candidates/app1-repo-local-context-pointer.json",
    "repo://teachers-app1@42f149a"
  ],
  "discovered_by": "context-engineer",
  "status": "processed",
  "verification": "verified",
  "disposition": "absorbed_by_existing",
  "disposition_note": "Covered by V1.1 repo-local context policy (Spec §3.3 + R6). Revisit adding App1 .ai/context.yaml when product engineering starts (T21+).",
  "disposition_refs": ["migration/repo-local/web-imagegen"],
  "processed_at": "2026-09-08T14:30:00Z",
  "created_at": "2026-09-06T16:51:00Z"
}
