{
  "schema_version": "1.1",
  "kind": "finding",
  "finding_id": "FIND-APP1-MIG-000002",
  "legacy_ids": ["app1-t23-thread-projection-engine-delivery"],
  "project_id": "app1",
  "task_id": "MIG-YZT-40",
  "summary": "Legacy candidate: T23 AttentionThread Projection Engine delivered in worktree branch agent/04-software-engineer/yzt-34 @ bac3ae3 (synthetic-only, 33 tests pass).",
  "detail": "Task delivery record = task progress. Task progress never enters long-term canonical memory (Checkpoint ≠ progress tracker; Issue ≠ memory). The durable part (TEST_ONLY policies are never product defaults) was extracted into a Rule.",
  "intent": "task_delivery",
  "source_refs": [
    "repo://multica-memory@61c6f0e/sources/candidates/app1-t23-thread-projection-engine-delivery.json",
    "multica://issue/YZT-34"
  ],
  "discovered_by": "software-engineer",
  "status": "processed",
  "verification": "partially_verified",
  "disposition": "forget",
  "disposition_note": "Progress state lives in Multica issues (YZT-34/35/36); App1 checkpoint cp-open-003 carries the implementation-reality summary with issue refs. TEST_ONLY guardrail canonicalized as RULE-APP1-000008.",
  "disposition_refs": ["multica://issue/YZT-34", "RULE-APP1-000008"],
  "processed_at": "2026-09-08T14:30:00Z",
  "created_at": "2026-09-07T05:55:00Z"
}
