{
  "schema_version": "1.1",
  "kind": "finding",
  "finding_id": "FIND-APP1-MIG-000004",
  "legacy_ids": ["app1-t25-followup-projection-engine-delivery"],
  "project_id": "app1",
  "task_id": "MIG-YZT-40",
  "summary": "Legacy candidate: T25 Follow-up Projection Engine delivered in worktree branch agent/04-software-engineer/yzt-36 (synthetic-only, 53 tests pass; TEST_ONLY_FOLLOWUP_RULE_V1).",
  "detail": "Task delivery record = task progress, not canonical memory. Durable part (TEST_ONLY rules never product defaults) extracted into RULE-APP1-000008.",
  "intent": "task_delivery",
  "source_refs": [
    "repo://multica-memory@61c6f0e/sources/candidates/app1-t25-followup-projection-engine-delivery.json",
    "multica://issue/YZT-36"
  ],
  "discovered_by": "software-engineer",
  "status": "processed",
  "verification": "partially_verified",
  "disposition": "forget",
  "disposition_note": "Same routing: issue refs (YZT-34/35/36) + checkpoint cp-open-003; TEST_ONLY guardrail in RULE-APP1-000008.",
  "disposition_refs": ["multica://issue/YZT-36", "RULE-APP1-000008"],
  "processed_at": "2026-09-08T14:30:00Z",
  "created_at": "2026-09-07T06:30:00Z"
}
